{
  "hook": "The fresh water beneath a car on an enclosed vehicle deck immediately feels wrong, and the revelation that Eli sent Nessa a message makes the mystery personal for Mara.",
  "tension": "The ferry is already crossing in a storm, mobile service is down, the maintenance stair appears to be opening, and Mara has only seconds to respond while Tom is occupied in the wheelhouse. Saye's guarded behaviour and Nessa's connection to Eli add separate sources of threat.",
  "clarity": "I understood the immediate situation, the ferry's enclosed layout, the seven-minute clock discrepancy, and Mara's history with Eli. I was less certain whether the three beeps indicated that the maintenance stair had opened or only that its alarm had been triggered, and what Saye believes is impossible about Nessa's ticket.",
  "character_pull": "Mara feels capable and contained, but her private anger and failure to defend Eli give her a painful stake in Nessa's message. I want to know whether she will protect Nessa, confront Saye, or discover that her past judgement of Eli was wrong.",
  "emotional_movement": "Mara begins in practical investigation, shifts into shock when Eli's name is spoken, then forces herself back into action. Her decision to postpone questions and investigate the stair shows fear being overridden by responsibility.",
  "strongest_moment": "Fresh water tracing a line from beneath the maintenance-stair door is the strongest moment. It turns the strange discovery into a direct, physical invitation or threat, while Mara is standing close enough to open it.",
  "confusions": [
    "I am unsure what makes Nessa's paper ticket impossible beyond the ferry clock being slow.",
    "I do not yet know whether Eli's message was recent, what it said, or how Nessa received it despite the disconnected number.",
    "I am uncertain whether the compass turning inland is a warning, a malfunction, or simply an unsettling detail."
  ],
  "predictions": [
    "Mara will open the maintenance stair despite the danger.",
    "Nessa may know more about Eli's disappearance than she has admitted.",
    "The grey document case is likely connected to the marina fire, Eli, or something Saye wants kept from the mainland.",
    "The water and the stair will lead to an explanation that may remain partly uncanny rather than fully ordinary."
  ],
  "desire_to_continue": "yes",
  "confidence": 0.98
}
